{"$id":"QK_GBFP8_HEAD64_ROLE_ENFORCED_ACCEPTANCE_STATIC_V27_FRESH_L2_ACCEPTANCE_SCHEMA","$schema":"https://json-schema.org/draft/2020-12/schema","additionalProperties":false,"properties":{"acceptance_created_atomically":{"const":true},"acceptance_file_count":{"const":1},"acceptance_file_mode":{"const":"0444"},"acceptance_sha256":{"pattern":"^[0-9a-f]{64}$","type":"string"},"accepted":{"const":true},"action_id":{"const":"ace2:qk-gbfp8-base-v27:role-enforced-acceptance:aaa22c19:additive-0004"},"artifact_kind":{"const":"qk_gbfp8_head64_role_enforced_acceptance_static_v27_fresh_l2_acceptance"},"candidate_action_tree_sha256":{"pattern":"^[0-9a-f]{64}$","type":"string"},"candidate_report_file_sha256":{"pattern":"^[0-9a-f]{64}$","type":"string"},"candidate_report_path":{"pattern":"^[A-Za-z0-9._/-]+$","type":"string"},"candidate_report_sha256":{"pattern":"^[0-9a-f]{64}$","type":"string"},"claim_boundary":{"const":"STATIC_ONLY_NO_EXECUTION_AUTHORITY"},"creator_provenance":{"additionalProperties":false,"properties":{"action_id":{"const":"ace2:qk-gbfp8-base-v27:role-enforced-acceptance:aaa22c19:additive-0004"},"active_call_id":{"pattern":"^[0-9a-f]{32}$","type":"string"},"actor":{"const":"reviewer"},"agent_layer":{"const":"reviewer"},"agent_start_event_line_number":{"minimum":1,"type":"integer"},"agent_start_event_sha256":{"pattern":"^[0-9a-f]{64}$","type":"string"},"authoritative_event_source":{"const":"ARGUS_PROJECT_EVENTS_JSONL"},"event_log_device":{"minimum":0,"type":"integer"},"event_log_inode":{"minimum":1,"type":"integer"},"event_log_snapshot_byte_count":{"minimum":1,"type":"integer"},"event_log_snapshot_sha256":{"pattern":"^[0-9a-f]{64}$","type":"string"},"mission_id":{"const":"v27roleenforcedacceptance"},"provenance_identity_sha256":{"pattern":"^[0-9a-f]{64}$","type":"string"},"provider_start_event_line_number":{"minimum":1,"type":"integer"},"provider_start_event_sha256":{"pattern":"^[0-9a-f]{64}$","type":"string"},"reviewer_command_event_line_number":{"minimum":1,"type":"integer"},"reviewer_command_event_sha256":{"pattern":"^[0-9a-f]{64}$","type":"string"},"run_label":{"const":"reviewer"},"working_dir_sha256":{"pattern":"^[0-9a-f]{64}$","type":"string"}},"required":["action_id","active_call_id","actor","agent_layer","agent_start_event_line_number","agent_start_event_sha256","authoritative_event_source","event_log_device","event_log_inode","event_log_snapshot_byte_count","event_log_snapshot_sha256","mission_id","provenance_identity_sha256","provider_start_event_line_number","provider_start_event_sha256","reviewer_command_event_line_number","reviewer_command_event_sha256","run_label","working_dir_sha256"],"type":"object"},"decision":{"const":"ACCEPT_STATIC_PACKAGE"},"launch_matrix_report_file_sha256":{"pattern":"^[0-9a-f]{64}$","type":"string"},"launch_matrix_report_path":{"pattern":"^[A-Za-z0-9._/-]+$","type":"string"},"launch_matrix_report_sha256":{"pattern":"^[0-9a-f]{64}$","type":"string"},"literal_b_independently_proven":{"const":true},"negative_fixture_report_file_sha256":{"pattern":"^[0-9a-f]{64}$","type":"string"},"negative_fixture_report_path":{"pattern":"^[A-Za-z0-9._/-]+$","type":"string"},"negative_fixture_report_sha256":{"pattern":"^[0-9a-f]{64}$","type":"string"},"negative_launch_count":{"const":18},"official_evaluator_invocation_count":{"const":0},"official_payload_open_count":{"const":0},"official_target_process_starts":{"const":0},"package_content_sha256":{"pattern":"^[0-9a-f]{64}$","type":"string"},"package_file_sha256":{"pattern":"^[0-9a-f]{64}$","type":"string"},"post_acceptance_verifier_file_sha256":{"pattern":"^[0-9a-f]{64}$","type":"string"},"pre_acceptance_mode_seal_exact":{"const":true},"provenance_audit_path":{"const":"fresh-l2-provenance-audit-0001/QK_GBFP8_HEAD64_ROLE_ENFORCED_ACCEPTANCE_STATIC_V27_PROVENANCE_AUDIT.json"},"provenance_identity_sha256":{"pattern":"^[0-9a-f]{64}$","type":"string"},"review_directory_final_mode":{"const":"0555"},"reviewer_role":{"const":"Fresh-L2"},"runtime_namespace_file_count":{"const":0},"static_acceptance_grants_execution_authority":{"const":false},"v21_or_predecessor_mutated":{"const":false},"v22_action_tree_sha256":{"const":"7bb7ffebf39c0a5fda8d85da24e05100e8cc6674d2f72a06be1321dd5b6f4dcb"},"v23_action_tree_sha256":{"const":"35f705b9ae3a85eb62654dbea6fd2b624ba122cda1d4b6feee27188922ebe93a"},"v24_acceptance_absent_before_v26_review":{"const":true},"v24_action_tree_sha256":{"const":"19e302a9cae9dc0f341253c45e3fad63a8ef5747b80ab786e32a394d27d5b672"},"v24_mutated_resealed_reinterpreted_or_accepted_in_place":{"const":false},"v24_package_file_sha256":{"const":"12b1f6045e591dd0e16235aeb4347d205b5eac9ae461846efe53c972aeb19097"},"v24_terminal_rejection_verified":{"const":true},"v25_acceptance_absent":{"const":true},"v25_action_tree_sha256":{"const":"ca176ab9116e7e0285dc943dbe0123a07cf728df3b6d6cb6a0485c636a24bdae"},"v25_mutated_resealed_replayed_or_accepted_in_place":{"const":false},"v25_package_file_sha256":{"const":"1e2b555027e8740bc5db17c7cd09ad9ff13bdb74ac1f32a246612135e045207a"},"v25_terminal_failure_verified":{"const":true},"v26_acceptance_file_sha256":{"const":"0bb542230a5df09277fa0020842a62fbc1414231de77612d08f10c17ca49987a"},"v26_action_tree_sha256":{"const":"86c17c45557c92c58ada0afd252fa960184f64c1692df72e085d2e07563427ec"},"v26_executed":{"const":false},"v26_mutated_resealed_replayed_or_accepted_in_place":{"const":false},"v26_package_file_sha256":{"const":"aaa22c19f76293a582c23b2d57c1f1cfa3344b43dd54961ae2779516bd521c9f"},"v26_positive_post_report_file_sha256":{"const":"ae5b0fd327017a59b34739badd5b14b3c84d2f683cb6550b008f40c3352ad279"},"v26_provenance_invalid_acceptance_preserved":{"const":true},"v27_executed":{"const":false}},"required":["acceptance_created_atomically","acceptance_file_count","acceptance_file_mode","acceptance_sha256","accepted","action_id","artifact_kind","candidate_action_tree_sha256","candidate_report_file_sha256","candidate_report_path","candidate_report_sha256","claim_boundary","decision","launch_matrix_report_file_sha256","launch_matrix_report_path","launch_matrix_report_sha256","literal_b_independently_proven","negative_fixture_report_file_sha256","negative_fixture_report_path","negative_fixture_report_sha256","negative_launch_count","official_evaluator_invocation_count","official_payload_open_count","official_target_process_starts","package_content_sha256","package_file_sha256","post_acceptance_verifier_file_sha256","pre_acceptance_mode_seal_exact","review_directory_final_mode","reviewer_role","runtime_namespace_file_count","static_acceptance_grants_execution_authority","v21_or_predecessor_mutated","v22_action_tree_sha256","v23_action_tree_sha256","v24_acceptance_absent_before_v26_review","v24_action_tree_sha256","v24_mutated_resealed_reinterpreted_or_accepted_in_place","v24_package_file_sha256","v24_terminal_rejection_verified","v26_executed","v25_acceptance_absent","v25_action_tree_sha256","v25_mutated_resealed_replayed_or_accepted_in_place","v25_package_file_sha256","v25_terminal_failure_verified","creator_provenance","provenance_audit_path","provenance_identity_sha256","v26_acceptance_file_sha256","v26_action_tree_sha256","v26_mutated_resealed_replayed_or_accepted_in_place","v26_package_file_sha256","v26_positive_post_report_file_sha256","v26_provenance_invalid_acceptance_preserved","v27_executed"],"type":"object"}
