{"acceptance_created_atomically":true,"acceptance_file_count":1,"acceptance_file_mode":"0444","acceptance_sha256":"a137497b85317c1b4baef9f3270eb9f4789aebdd438a210edea623cb41b723b5","accepted":true,"action_id":"ace2:qk-gbfp8-base-v27:role-enforced-acceptance:aaa22c19:additive-0004","artifact_kind":"qk_gbfp8_head64_role_enforced_acceptance_static_v27_fresh_l2_acceptance","candidate_action_tree_sha256":"5da2572f9cd3a4f74e1a3ebe154cfc34fe32fbac5919bc9b6d92426a6329a319","candidate_report_file_sha256":"4946a155f28e999a6f687c0d62553487a2173e9a2d8c54b8239f5c61c706c95a","candidate_report_path":"fresh-l2-sealed-0001/QK_GBFP8_HEAD64_ROLE_ENFORCED_ACCEPTANCE_STATIC_V27_CANDIDATE_REPORT.json","candidate_report_sha256":"3742e8a10e7bafb50dde6da6ac37c764e4bc0c8e2e81a3f0adf5494af4338318","claim_boundary":"STATIC_ONLY_NO_EXECUTION_AUTHORITY","creator_provenance":{"action_id":"ace2:qk-gbfp8-base-v27:role-enforced-acceptance:aaa22c19:additive-0004","active_call_id":"a6a705aef4f744ce845fbf1e609eb4e8","actor":"reviewer","agent_layer":"reviewer","agent_start_event_line_number":86158,"agent_start_event_sha256":"6121bbd1acd1bfa4a61b07f5189ae97f0d86030feac4142757a12410d5bc79f4","authoritative_event_source":"ARGUS_PROJECT_EVENTS_JSONL","event_log_device":66305,"event_log_inode":5221814,"event_log_snapshot_byte_count":102696053,"event_log_snapshot_sha256":"1a45d7aa0d24a646f0c3754c7ddd8b457026c05ef781e60fa67d6c348da1e43c","mission_id":"v27roleenforcedacceptance","provenance_identity_sha256":"c2af08e4949622f8db8d4f64496647d43d238a1519f627cc4ac75c036ba66cac","provider_start_event_line_number":86157,"provider_start_event_sha256":"3d7120eb8b3834dca87debe16d9b120f5e4441b33872b2094fb6aaa73b0b05aa","reviewer_command_event_line_number":86181,"reviewer_command_event_sha256":"226d1547298664ba7532ba8ca5e8ab870886a5c400b0f484fbd262922cbffabd","run_label":"reviewer","working_dir_sha256":"b7a83be9b179c1134203241f623492789b84a7df221c1e2ab88e40e8a0d24ef0"},"decision":"ACCEPT_STATIC_PACKAGE","launch_matrix_report_file_sha256":"ab3e3a668f301234f31540ec9d8bc7eacb51d305b11625e6bdaf7e02ffe1883f","launch_matrix_report_path":"fresh-l2-sealed-0001/QK_GBFP8_HEAD64_ROLE_ENFORCED_ACCEPTANCE_STATIC_V27_LAUNCH_MATRIX_REPORT.json","launch_matrix_report_sha256":"ebe3d5ed10fa5632454a2b5b43c24ec3c4ab4a4796685cef31e17006490f21da","literal_b_independently_proven":true,"negative_fixture_report_file_sha256":"22e69f74422aa0ae823c5042c67f4de998493c3609610db34c8576973465fbc1","negative_fixture_report_path":"fresh-l2-sealed-0001/QK_GBFP8_HEAD64_ROLE_ENFORCED_ACCEPTANCE_STATIC_V27_NEGATIVE_FIXTURE_REPORT.json","negative_fixture_report_sha256":"5a81ef9bd1feac79524e7553f44e670f1157b8fc4885c250308f05e49497b12e","negative_launch_count":18,"official_evaluator_invocation_count":0,"official_payload_open_count":0,"official_target_process_starts":0,"package_content_sha256":"38571d38526d73b71c69eecc9ecb229ced1d4c5798430a09b33b9e5161584df3","package_file_sha256":"99e20b22047199e3f2f3724f02c1b4e8a881f1c8170c3af851fe6089284f235d","post_acceptance_verifier_file_sha256":"c8e3f158e1b5c007c382f858a2ba9e8fd9088fb0764746c8c91f476fe71e9488","pre_acceptance_mode_seal_exact":true,"provenance_audit_path":"fresh-l2-provenance-audit-0001/QK_GBFP8_HEAD64_ROLE_ENFORCED_ACCEPTANCE_STATIC_V27_PROVENANCE_AUDIT.json","provenance_identity_sha256":"c2af08e4949622f8db8d4f64496647d43d238a1519f627cc4ac75c036ba66cac","review_directory_final_mode":"0555","reviewer_role":"Fresh-L2","runtime_namespace_file_count":0,"static_acceptance_grants_execution_authority":false,"v21_or_predecessor_mutated":false,"v22_action_tree_sha256":"7bb7ffebf39c0a5fda8d85da24e05100e8cc6674d2f72a06be1321dd5b6f4dcb","v23_action_tree_sha256":"35f705b9ae3a85eb62654dbea6fd2b624ba122cda1d4b6feee27188922ebe93a","v24_acceptance_absent_before_v26_review":true,"v24_action_tree_sha256":"19e302a9cae9dc0f341253c45e3fad63a8ef5747b80ab786e32a394d27d5b672","v24_mutated_resealed_reinterpreted_or_accepted_in_place":false,"v24_package_file_sha256":"12b1f6045e591dd0e16235aeb4347d205b5eac9ae461846efe53c972aeb19097","v24_terminal_rejection_verified":true,"v25_acceptance_absent":true,"v25_action_tree_sha256":"ca176ab9116e7e0285dc943dbe0123a07cf728df3b6d6cb6a0485c636a24bdae","v25_mutated_resealed_replayed_or_accepted_in_place":false,"v25_package_file_sha256":"1e2b555027e8740bc5db17c7cd09ad9ff13bdb74ac1f32a246612135e045207a","v25_terminal_failure_verified":true,"v26_acceptance_file_sha256":"0bb542230a5df09277fa0020842a62fbc1414231de77612d08f10c17ca49987a","v26_action_tree_sha256":"86c17c45557c92c58ada0afd252fa960184f64c1692df72e085d2e07563427ec","v26_executed":false,"v26_mutated_resealed_replayed_or_accepted_in_place":false,"v26_package_file_sha256":"aaa22c19f76293a582c23b2d57c1f1cfa3344b43dd54961ae2779516bd521c9f","v26_positive_post_report_file_sha256":"ae5b0fd327017a59b34739badd5b14b3c84d2f683cb6550b008f40c3352ad279","v26_provenance_invalid_acceptance_preserved":true,"v27_executed":false}
